{
  "$schema": "./registry.schema.json",
  "version": 1,
  "note": "VibeCode QA standards registry. Maps a repo or slice detectable signals to the published or planned standards it should be judged against. Consumers: the vcqa CLI/engine, deterministic resolvers, and AI judges that must use fixed standards instead of memory. See SCHEMA.md.",
  "signals": {
    "note": "Reference of the atoms a `detect` predicate may test, gathered per slice or repo by the resolver.",
    "dep": "a dependency name present in package.json (deps + devDeps) or pubspec.yaml (dependencies + dev_dependencies)",
    "file": "an exact file present in the slice",
    "fileGlob": "a glob matched within the slice",
    "config": "a parsed key present (e.g. wrangler.toml has [[d1_databases]], pubspec.yaml, firebase.json, melos.yaml)"
  },
  "standards": [
    {
      "id": "react-spa",
      "type": "archetype",
      "title": "React SPA",
      "summary": "React, client-rendered, hosted as static files. No SSR, no server of its own.",
      "url": "https://vibecodeqa.online/standards/react-spa/v1/",
      "repo": "vibecodeqa/vibecodeqa",
      "appliesTo": "slice",
      "status": "published",
      "maturity": "authored-rubric",
      "maturityNote": null,
      "detect": {
        "all": [
          {
            "dep": "react"
          },
          {
            "dep": "react-dom"
          },
          {
            "anyDep": [
              "vite",
              "webpack",
              "esbuild",
              "@rsbuild/core"
            ]
          },
          {
            "noneDep": [
              "next",
              "nuxt",
              "@remix-run/react",
              "@react-router/dev",
              "express",
              "hono",
              "fastify",
              "@nestjs/core"
            ]
          },
          {
            "noneFileGlob": [
              "functions/**/*.{ts,js}",
              "server/**/*.{ts,js}"
            ]
          }
        ]
      },
      "recommends": [
        "typescript",
        "security",
        "testing",
        "accessibility",
        "dependencies"
      ],
      "optionalLayers": [
        "tailwind",
        "tanstack-query",
        "zod-validation",
        "oauth-client"
      ],
      "editions": [
        {
          "version": "v1",
          "path": "/v1",
          "status": "latest",
          "reviewed": "2026-07",
          "nextReview": "2027-07",
          "targets": {
            "react": "19",
            "vite": "8",
            "tailwind": "4",
            "typescript": "6",
            "node": ">=20.19; prefer 22.12+ or 24 LTS"
          },
          "lifecycle": {
            "deprecated": false,
            "supersededBy": null,
            "errata": [],
            "changelog": []
          }
        }
      ],
      "aliases": [
        "react-spa-static"
      ],
      "standardUrl": "https://vibecodeqa.online/standards/react-spa/v1/",
      "docsUrl": "/docs/standards/stacks/react-spa/"
    },
    {
      "id": "cloudflare-pages-fullstack",
      "type": "archetype",
      "title": "Cloudflare Pages Fullstack",
      "summary": "Server-side API co-deployed with a static frontend as Cloudflare Pages Functions. Edge runtime, bindings, no long-lived server.",
      "url": "https://vibecodeqa.online/standards/cloudflare-pages-fullstack/v1/",
      "repo": "vibecodeqa/vibecodeqa",
      "appliesTo": "slice",
      "status": "published",
      "maturity": "authored-rubric",
      "maturityNote": null,
      "detect": {
        "all": [
          {
            "file": "wrangler.toml"
          },
          {
            "anyFileGlob": [
              "functions/**/*.{ts,js}",
              "**/functions/**/*.{ts,js}"
            ]
          }
        ]
      },
      "recommends": [
        "typescript",
        "security",
        "dependencies"
      ],
      "optionalLayers": [
        "cloudflare-d1-app",
        "r2-storage",
        "cf-access"
      ],
      "editions": [
        {
          "version": "v1",
          "path": "/v1",
          "status": "latest",
          "reviewed": "2026-07",
          "nextReview": "2027-07",
          "targets": {
            "cloudflarePagesFunctions": "latest",
            "typescript": "6"
          },
          "lifecycle": {
            "deprecated": false,
            "supersededBy": null,
            "errata": [],
            "changelog": []
          }
        }
      ],
      "aliases": [
        "pages-fullstack"
      ],
      "standardUrl": "https://vibecodeqa.online/standards/cloudflare-pages-fullstack/v1/",
      "docsUrl": "/docs/standards/stacks/cloudflare-pages-fullstack/"
    },
    {
      "id": "cloudflare-worker-mcp-server",
      "type": "archetype",
      "title": "Cloudflare Worker MCP Server",
      "summary": "A remote MCP server hosted on Cloudflare Workers, with Worker-bound authorization, tool schemas, validation, storage boundaries, and auditability.",
      "url": "https://vibecodeqa.online/standards/cloudflare-worker-mcp-server/v2/",
      "repo": "vibecodeqa/vibecodeqa",
      "appliesTo": "slice",
      "status": "published",
      "maturity": "authored-rubric",
      "maturityNote": null,
      "detect": {
        "all": [
          {
            "anyFile": [
              "wrangler.toml",
              "wrangler.jsonc",
              "wrangler.json"
            ]
          },
          {
            "anyFileGlob": [
              "src/**/*.{ts,js}"
            ]
          },
          {
            "anyDep": [
              "@modelcontextprotocol/sdk"
            ]
          },
          {
            "noneFileGlob": [
              "functions/**/*.{ts,js}",
              "index.html"
            ]
          }
        ]
      },
      "recommends": [
        "typescript",
        "security",
        "testing",
        "dependencies"
      ],
      "coveredLayers": [
        "mcp-server",
        "zod-validation",
        "durable-objects"
      ],
      "editions": [
        {
          "version": "v1",
          "path": "/v1",
          "status": "retired",
          "reviewed": "2026-07",
          "nextReview": "2027-07",
          "targets": {
            "cloudflareWorkers": "latest",
            "mcp": "2025-11-25",
            "typescript": "6"
          },
          "lifecycle": {
            "deprecated": true,
            "supersededBy": "v2",
            "errata": [],
            "changelog": [
              "Superseded by v2 for MCP 2026-07-28 stateless Streamable HTTP and Cloudflare createMcpHandler guidance."
            ]
          }
        },
        {
          "version": "v2",
          "path": "/v2",
          "status": "latest",
          "reviewed": "2026-08",
          "nextReview": "2027-08",
          "targets": {
            "cloudflareWorkers": "latest",
            "cloudflareAgentsMcp": "createMcpHandler",
            "mcp": "2026-07-28",
            "typescript": "6"
          },
          "lifecycle": {
            "deprecated": false,
            "supersededBy": null,
            "errata": [],
            "changelog": [
              "Cuts a current stateless MCP 2026-07-28 edition with server/discover, mirrored Streamable HTTP headers, cacheable list/read results, compatibility lanes, abuse controls, and rule-contract severity/evidence language."
            ]
          }
        }
      ],
      "aliases": [],
      "standardUrl": "https://vibecodeqa.online/standards/cloudflare-worker-mcp-server/v2/",
      "docsUrl": "/docs/standards/stacks/cloudflare-worker-mcp-server/"
    },
    {
      "id": "worker-edge",
      "type": "archetype",
      "title": "Cloudflare Worker",
      "summary": "A standalone Cloudflare Worker (or Durable Object) service. Edge runtime, module worker, bindings.",
      "url": null,
      "repo": "vibecodeqa/vibecodeqa",
      "appliesTo": "slice",
      "status": "planned",
      "maturity": "backlog",
      "maturityNote": "Resolver-only entry. The detection predicate exists so gap reports name the right standard; no charter page has been authored.",
      "detect": {
        "all": [
          {
            "anyFile": [
              "wrangler.toml",
              "wrangler.jsonc",
              "wrangler.json"
            ]
          },
          {
            "anyFileGlob": [
              "src/**/*.{ts,js}"
            ]
          },
          {
            "noneDep": [
              "@modelcontextprotocol/sdk"
            ]
          },
          {
            "noneFileGlob": [
              "functions/**/*.{ts,js}",
              "index.html"
            ]
          }
        ]
      },
      "recommends": [
        "typescript",
        "security",
        "dependencies"
      ],
      "optionalLayers": [
        "cloudflare-d1-app",
        "r2-storage",
        "durable-objects"
      ],
      "editions": [],
      "aliases": [],
      "standardUrl": null,
      "docsUrl": null
    },
    {
      "id": "node-cli-internal-tool",
      "type": "archetype",
      "title": "Node CLI Internal Tool",
      "summary": "A Node command-line tool used by developers or CI, with stable exit codes, credential resolution, structured output, and noninteractive safety.",
      "url": "https://vibecodeqa.online/docs/standards/stacks/node-cli-internal-tool/",
      "repo": "vibecodeqa/vibecodeqa",
      "appliesTo": "slice",
      "status": "planned",
      "maturity": "candidate-rubric",
      "maturityNote": "Twelve candidate rules carry severity, evidence, and exception terms, and `ref-node-cli-internal-tool` is published with a self-reported score and a green CI run. Blocking v1: no independent assessment of the reference repo exists, and the exit-code and JSON-mode rules have no scanner signal yet.",
      "detect": {
        "any": [
          {
            "config": "package.json:bin"
          },
          {
            "anyDep": [
              "commander",
              "yargs"
            ]
          }